
序号,期刊名称,主办(管)单位,CN号
1.,公共管理学报,哈尔滨工业大学管理学院,CN23-1523/F
2.,管理工程学报,浙江大学,CN33-1136/N
3.,管理科学,哈尔滨工业大学管理学院,CN23-1510/C
4.,管理科学学报,国家自然科学基金委员会管理科学部,CN12-1275/G3
5.,管理评论,中国科学院研究生院,CN11-5057/F
6.,管理世界,中华人民共和国国务院发展研究中心,CN11-1235/F
7.,管理学报,华中科技大学,CN42-1725/C
8.,华东经济管理,安徽经济管理学院,CN34-1014/F
9.,经济管理,中国社会科学院工业经济研究所,CN11-1047/F
10.,经济体制改革,四川省社会科学院,CN51-1027/F
11.,科技管理研究,广东省科学学与科技管理研究会,CN44-1223/G3
12.,科技进步与对策,湖北省科技信息研究院,CN42-1224/G3
13.,科学管理研究,内蒙古自治区软科学研究会,CN15-1103/G3
14.,科学学研究,中国科学学与科技政策研究会,CN11-1805/G3
15.,科学学与科学技术管理,中国科学学与科技政策研究会等,CN12-1117/G3
16.,科研管理,中国科学院科技政策与管理科学研究所,CN11-1567/G3
17.,南开管理评论,南开大学商学院,CN12-1288/F
18.,软科学,四川省科技促进发展研究中心,CN51-1268/G3
19.,外国经济与管理,上海财经大学,CN31-1063/F
20.,系统工程,湖南省系统工程与管理学会,CN43-1115/N
21.,系统工程理论与实践,中国系统工程学会,CN11-2267/N
22.,系统管理学报,上海交通大学,CN31-1977/N
23.,研究与发展管理,复旦大学,CN31-1599/G3
24.,预测,合肥工业大学预测与发展研究所,CN34-1013/N
25.,中国管理科学,中国优选法统筹法与经济数学研究会,CN11-2835/G3
26.,中国行政管理,中国行政管理学会,CN11-1145/D
27.,中国科技论坛,中国科学技术发展战略研究院,CN11-1344/G3
28.,中国科学基金,国家自然科学基金委员会,CN11-1730/N
29.,中国软科学,中国软科学研究会,CN11-3036/G3
序号,期刊名称,主办(管)单位,CN号
1.,当代世界社会主义问题,山东大学当代社会主义研究所,CN37-1065/D
2.,当代世界与社会主义,中共中央编译局马克思主义研究部等,CN11-3404/D
3.,党史研究与教学,中共福建省委党校、福建省中共党史学会,CN35-1059/A
4.,国外理论动态,中共中央编译局、世界发展战略研究部,CN11-4507/D
5.,红旗文稿,求是杂志社,CN11-4904/D
6.,教学与研究,中国人民大学,CN11-1454/G4
7.,科学社会主义,中国科学社会主义学会,CN11-2797/D
8.,理论视野,中国马克思主义研究基金会,CN11-3953/A
9.,马克思主义研究,马克思主义研究院、马克思主义研究学部,CN11-3591/A
10.,马克思主义与现实,中共中央编译局当代马克思主义研究所,CN11-3040/A
11.,毛泽东邓小平理论研究,上海社会科学院等,CN31-1672/A
12.,求是,中国共产党中央委员会,CN11-1000/D
13.,社会主义研究,华中师范大学,CN42-1093/D
14.,思想理论教育导刊,高等教育出版社,CN11-4062/G4
15.,中共党史研究,中共党史研究室,CN11-1675/D
16.,中国特色社会主义研究,北京市社会科学界联合会等,CN11-3527/D
序号,期刊名称,主办(管)单位,CN号
1.,道德与文明,中国伦理学会、天津社会科学院,CN12-1029/B
2.,科学技术哲学研究,山西大学、山西省自然辩证法研究会,CN14-1354/G3
3.,孔子研究,中国孔子基金会,CN37-1037/C
4.,伦理学研究,湖南师范大学伦理学研究所,CN43-1385/C
5.,世界哲学,中国社会科学院哲学所,CN11-4748/B
6.,现代哲学,广东哲学学会,CN44-1071/B
7.,哲学动态,中国社会科学院哲学研究所,CN11-1141/B
8.,哲学研究,中国社会科学院哲学研究所,CN11-1140/B
9.,中国哲学史,中国哲学史学会,CN11-3042/B
10.,周易研究,山东大学、中国周易学会,CN37-1191/C
11.,自然辩证法通讯,中国科学院研究生院,CN11-1518/N
12.,自然辩证法研究,中国自然辩证法研究会,CN11-1649/B
序号,期刊名称,主办(管)单位,CN号
1.,世界宗教文化,中国社会科学院世界宗教研究所,CN11-3631/B
2.,世界宗教研究,中国社会科学院世界宗教研究所,CN11-1299/B
3.,宗教学研究,四川大学道教与宗教文化研究所,CN51-1069/B
序号,期刊名称,主办(管)单位,CN号
1.,当代修辞学,复旦大学,CN31-2043/H
2.,当代语言学,中国社会科学院语言研究所,CN11-3879/H
3.,方言,中国社会科学院语言研究所,CN11-1052/H
4.,汉语学报,华中师范大学,CN42-1729/H
5.,民族语文,中国社会科学院民族学与人类学研究所,CN11-1216/H
6.,世界汉语教学,北京语言大学,CN11-1473/H
7.,外国语,上海外国语大学,CN31-1038/H
8.,外语电化教学,上海外国语大学,CN31-1036/G4
9.,外语教学,西安外国语大学,CN61-1023/H
10.,外语教学理论与实践,华东师范大学外语学院,CN31-1964/H
11.,外语教学与研究,北京外国语大学,CN11-1251/G4
12.,外语界,上海外国语大学,CN31-1040/H
13.,外语学刊,黑龙江大学,CN23-1071/H
14.,外语与外语教学,大连外国语大学,CN21-1060/H
15.,现代外语,广东外语外贸大学,CN44-1165/H
16.,语文研究,山西省社会科学院,CN14-1059/H
17.,语言教学与研究,北京语言大学,CN11-1472/H
18.,语言科学,江苏师范大学语言研究所,CN32-1687/G
19.,语言文字应用,教育部语言文字应用研究所,CN11-2888/H
20.,语言研究,华中科技大学中国语言研究所,CN42-1025/H
21.,中国翻译,中国外文局对外传播研究中心等,CN11-1354/H
22.,中国外语,高等教育出版社,CN11-5280/H
23.,中国语文,中国社会科学院语言研究所,CN11-1053/H
序号,期刊名称,主办(管)单位,CN号
1,当代外国文学,南京大学外国文学研究所,CN32-1087/I
2,俄罗斯文艺,北京师范大学,CN11-5702/I
3,国外文学,北京大学,CN11-1562/I
4,外国文学,北京外国语大学,CN11-1248/I
5,外国文学评论,中国社会科学院外国文学研究所,CN11-1068/I
6,外国文学研究,华中师范大学文学院,CN42-1060/I
序号,期刊名称,主办(管)单位,CN号
1,当代文坛,四川省作家协会,CN51-1076/I
2,当代作家评论,辽宁省作家协会,CN21-1046/I
3,红楼梦学刊,中国艺术研究院,CN11-1676/I
4,鲁迅研究月刊,北京鲁迅博物馆,CN11-2722/I
5,民族文学研究,中国社会科学院民族文学研究所,CN11-1443/I
6,南方文坛,广西文联,CN45-1049/I
7,文学评论,中国社会科学院文学研究所,CN11-1037
8,文学遗产,中国社会科学院文学研究所,CN11-1009/I
9,文艺理论研究,中国文艺理论学会、华东师范大学,CN31-1152/I
10,文艺理论与批评,中国艺术研究院,CN11-1581/J
11,文艺争鸣,吉林省文学艺术界联合会,CN22-1031
12,小说评论,陕西省作家协会,CN61-1071/J
13,新文学史料,人民文学出版社,CN11-1283/I
14,扬子江评论,江苏省作家协会,CN32-1787/I
15,中国比较文学,上海外国语大学、中国比较文学学会,CN31-1694/I
16,中国现代文学研究丛刊,中国现代文学馆,CN11-2589/I
序号,期刊名称,主办(管)单位,CN号
1.,北京舞蹈学院学报,北京舞蹈学院,CN11-3982/J
2.,当代电影,中国电影艺术研究中心等,CN11-1447/G2
3.,电影艺术,中国电影家协会,CN11-1528/J
4.,美术观察,中国艺术研究院,CN11-3665/J
5.,美术研究,中央美术学院,CN11-1190/J
6.,民族艺术,广西民族文化艺术研究院,CN45-1052/J
7.,南京艺术学院学报((美术与设计版),南京艺术学院,CN32-1008/J
8.,世界电影,中国电影家协会,CN11-2023/G2
9.,文艺研究,中国艺术研究院,CN11-1672/J
10.,戏剧,中央戏剧学院,CN11-1159/J
11.,戏剧艺术,上海戏剧学院,CN31-1140/J
12.,戏曲艺术,中国戏曲学院,CN11-1172/J
13.,新美术,中国美术学院学报,CN33-1068/J
14.,艺术百家,江苏省文化艺术研究院,CN32-1092/J
15.,音乐研究,人民音乐出版社,CN11-1665/J
16.,音乐艺术(上海音乐学院学报),上海音乐学院,CN31-1004/J
17.,中国电视,中国电视艺术委员会,CN11-2750/J
18.,中国书法,中国书法家协会,CN11-1136/J
19.,中国音乐学,中国艺术研究院,CN11-1316/J
20.,中央音乐学院学报,中央音乐学院,CN11-1183/J
21.,装饰,清华大学,CN11-1392/J
序号,期刊名称,主办(管)单位,CN号
1.,安徽史学,安徽省社会科学院,CN34-1008/K
2.,当代中国史研究,当代中国研究所,CN11-3200/K
3.,东南文化,南京博物院,CN32-1096/K
4.,古代文明,东北师范大学世界古典文明史研究所等,CN22-1213/K
5.,华侨华人历史研究,中国华侨华人历史研究所,CN11-1158/K
6.,近代史研究,中国社会科学院近代史研究所,CN11-1215/K
7.,抗日战争研究,中国社会科学院近代史研究所等,CN11-2890/K
8.,历史档案,中国第一历史档案馆,CN11-1265/G2
9.,历史教学,历史教学社,CN12-1010/G4
10.,历史研究,中国社会科学院,CN11-1213/K
11.,民国档案,中国第二历史档案馆,CN32-1012/G2
12.,清史研究,中国人民大学清史研究所,CN11-2765/K
13.,史林,上海社会科学院历史研究所,CN31-1105/K
14.,史学集刊,吉林大学,CN22-1064/K
15.,史学理论研究,中国社会科学院世界历史研究所,CN11-2943/K
16.,史学史研究,北京师范大学,CN11-1667/K
17.,史学月刊,河南大学、河南省历史学会,CN41-1016/K
18.,世界历史,中国社会科学院世界历史研究所,CN11-1046/K
19.,文史,中华书局,CN11-1678/K
20.,文献,国家图书馆,CN11-1588/G2
21.,西域研究,新疆社会科学院,CN65-1121/C
22.,中国边疆史地研究,中国社会科学院中国边疆史地研究中心,CN11-2795/K
23.,中国历史地理论丛,陕西师范大学,CN61-1027/K
24.,中国农史,中国农业历史学会等,CN32-1061/S
25.,中国史研究,中国社会科学院历史研究所,CN11-1039/K
26.,中华文史论丛,上海世纪出版股份有限公司古籍出版社,CN31-1984/K
序号,期刊名称,主办(管)单位,CN号
1,敦煌研究,敦煌研究院,CN62-1007/K
2,故宫博物院院刊,故宫博物院,CN11-1202/G2
3,江汉考古,湖北省文物考古研究所,CN42-1077/K
4,考古,中国社会科学院考古研究所,CN11-1208
5,考古学报,中国社会科学院考古研究所,CN11-1209
6,考古与文物,陕西省考古研究院,CN61-1010/K
7,文物,文物出版社,CN11-1532/K
序号,期刊名称,主办(管)单位,CN号
1.,财经科学,西南财经大学,CN51-1104/F
2.,财经理论与实践,湖南大学,CN43-1057/F
3.,财经论丛,浙江财经大学,CN33-1154/F
4.,财经问题研究,东北财经大学,CN21-1096/F
5.,财经研究,上海财经大学,CN31-1012/F
6.,财贸经济,中国社会科学院财经战略研究院,CN11-1166/F
7.,财贸研究,安徽财经大学,CN34-1093/F
8.,财政研究,中国财政学会,CN11-1077/F
9.,产业经济研究,南京财经大学,CN32-1683/F
10.,城市发展研究,中国城市科学研究会,CN11-3504/TU
11.,城市问题,北京市社会科学院,CN11-1119/C
12.,当代财经,江西财经大学,CN36-1030/F
13.,当代经济科学,西安交通大学,CN61-1400/F
14.,当代经济研究,吉林财经大学,CN22-1232/F
15.,改革,重庆社会科学院,CN50-1012/F
16.,广东财经大学学报,广东财经大学,CN44-1446/F
17.,国际金融研究,中国国际金融学会,CN11-1132/F
18.,国际经济评论,中国社会科学院世界经济与政治研究所,CN11-3799/F
19.,国际经贸探索,广东外语外贸大学,CN44-1302/F
20.,国际贸易,中国商务出版社,CN11-1600/F
21.,国际贸易问题,对外经济贸易大学,CN11-1692/F
22.,国际商务(对外经济贸易大学学报),对外经济贸易大学,CN11-3645/F
23.,河北经贸大学学报,河北经贸大学,CN13-1207/F
24.,宏观经济研究,国家发展和改革委员会宏观经济研究院,CN11-3952/F
25.,会计研究,中国会计学会,CN11-1078/F
26.,价格理论与实践,中国价格协会,CN11-1010/F
27.,江西财经大学学报,江西财经大学,CN36-1224/F
28.,金融经济学研究,广东金融学院,CN44-1696/F
29.,金融研究,中国金融学会,CN11-1268/F
30.,经济经纬,河南财经政法大学,CN41-1421/F
31.,经济科学,北京大学,CN11-1564/F
32.,经济理论与经济管理,中国人民大学,CN11-1517/F
33.,经济评论,武汉大学,CN42-1348/F
34.,经济社会体制比较,世界发展战略研究部,CN11-1591/F
35.,经济问题,山西省社会科学院,CN14-1058/F
36.,经济问题探索,云南省发展和改革委员会,CN53-1006/F
37.,经济学(季刊),北京大学中国经济研究中心
CN,11-6010/F
38.,经济学动态,中国社会科学院经济研究所,CN11-1057/F
39.,经济学家,西南财经大学,CN51-1312/F
40.,经济研究,中国社会科学院经济研究所,CN11-1081/F
41.,经济与管理研究,首都经济贸易大学,CN11-1384/F
42.,经济纵横,吉林省社会科学院,CN22-1054/F
43.,南方经济,广东经济学会、广东省社会科学院,CN44-1068/F
44.,南开经济研究,南开大学经济学院,CN12-1028/F
45.,农村经济,四川省农业经济学会,CN51-1029/F
46.,农业技术经济,中国农业技术经济研究会,CN11-1883/S
47.,农业经济问题,中国农业经济学会,CN11-1323/F
48.,山西财经大学学报,山西财经大学,CN14-1221/F
49.,商业经济与管理,浙江工商大学,CN33-1336/F
50.,上海财经大学学报,上海财经大学,CN31-1817/C
51.,上海经济研究,上海社会科学院经济研究所,CN31-1163/F
52.,审计研究,中国审计学会,CN11-1024/F
53.,审计与经济研究,南京审计学院,CN32-1317/F
54.,世界经济,中国社会科学院世界经济与政治研究所,CN11-1138/F
55.,世界经济文汇,复旦大学,CN31-1139/F
56.,世界经济研究,上海社会科学院世界经济研究所,CN31-1048/F
57.,世界经济与政治论坛,江苏省社会科学院世界经济研究所,CN32-1544/F
58.,数量经济技术经济研究,数量经济与技术经济研究所,CN11-1087/F
59.,税务研究,中国税务杂志社,CN11-1011/F
60.,现代经济探讨,江苏省社会科学院,CN32-1566/F
61.,现代日本经济,吉林大学、全国日本经济学会,CN22-1065/F
62.,亚太经济,福建社会科学院,CN35-1014/F
63.,云南财经大学学报,云南财经大学,CN53-1209/F
64.,证券市场导报,深圳证劵交易所综合研究所,CN44-1343/F
65.,政治经济学评论,中国人民大学,CN11-5859/D
66.,中国工业经济,中国社会科学院工业经济研究所,CN11-3536/F
67.,中国经济问题,厦门大学经济研究所,CN35-1020/F
68.,中国农村观察,中国社会科学院农村发展研究所,CN11-3586/F
69.,中国农村经济,中国社会科学院农村发展研究所,CN11-1262/F
70.,中国社会经济史研究,厦门大学历史研究所,CN35-1023/F
71.,中国土地科学,中国土地学会、中国土地勘测规划院,CN11-2640/F
72.,中南财经政法大学学报,中南财经政法大学,CN42-1663/F
73.,中央财经大学学报,中央财经大学,CN11-3846/F
序号,期刊名称,主办(管)单位,CN号
1.,北京行政学院学报,北京行政学院,CN11-4054/D
2.,当代亚太,中国社会科学院亚洲太平洋研究所等,CN11-3706/C
3.,德国研究,同济大学德国问题研究所,CN31-2032/C
4.,东北亚论坛,吉林大学,CN22-1180/C
5.,东南亚研究,暨南大学东南亚研究所,CN44-1124/D
6.,俄罗斯东欧中亚研究,中国社会科学院俄罗斯东欧中亚研究所,CN11-4809/D
7.,公共行政评论,广东省行政体制改革研究中心,CN44-1648/D
8.,国际观察,上海外国语大学,CN31-1642/D
9.,国际论坛,北京外国语大学,CN11-3959/D
10.,国际问题研究,中国国际问题研究所,CN11-1504/D
11.,国际政治研究,北京大学,CN11-4782/D
12.,国家行政学院学报,国家行政学院,CN11-4097/D
13.,行政论坛,黑龙江省行政学院,CN23-1360/D
14.,江苏行政学院学报,江苏省行政学院,CN32-1562/C
15.,理论探索,中共山西省委党校、山西行政学院,CN14-1079/C
16.,理论探讨,中共黑龙江省委党校,CN23-1013/D
17.,理论学刊,中共山东省委党校,CN37-1059/D
18.,理论与改革,中共中央四川省委党校,CN51-1036/D
19.,美国研究,中国社会科学院美国研究所、中华美国学会,CN11-1170/C
20.,南亚研究,中国社会科学院亚洲太平洋研究所等,CN11-1306/C
21.,南洋问题研究,厦门大学南洋研究院,CN35-1054/C
22.,欧洲研究,中国社会科学院欧洲研究所,CN11-4899/C
23.,日本学刊,中国社会科学院日本研究所、中华日本学会,CN11-2747/D
24.,上海行政学院学报,上海行政学院,CN31-1815
25.,世界经济与政治,中国社会科学院世界经济与政治研究所,CN11-1343/F
26.,台湾研究集刊,厦门大学台湾研究院,CN35-1022/C
27.,太平洋学报,中国太平洋学会,CN11-3152/K
28.,探索,中共重庆市委党校,CN50-1019/D
29.,外交评论(外交学院学报),外交学院,CN11-5370/D
30.,现代国际关系,中国现代国际关系研究院,CN11-1134/D
31.,政治学研究,中国社会科学院政治学研究所,CN11-1396/D
32.,中共中央党校学报,中共中央党校,CN11-3847/C
序号,期刊名称,主办(管)单位,CN号
1.,比较法研究,中国政法大学比较法研究所,CN11-3171/D
2.,当代法学,吉林大学,CN22-1051/D
3.,法律科学,西北政法大学,CN61-1470/D
4.,法商研究,中南财经政法大学,CN42-1664/D
5.,法学,华东政法大学,CN31-1050/D
6.,法学家,中国人民大学,CN11-3212/D
7.,法学论坛,山东省法学会,CN37-1343/D
8.,法学评论,武汉大学,CN42-1086/D
9.,法学研究,中国社会科学院法学研究所,CN11-1162/D
10.,法学杂志,北京市法学会,CN11-1648/D
11.,法制与社会发展,吉林大学,CN22-1243/D
12.,华东政法大学学报,华东政法大学,CN31-2005/D
13.,环球法律评论,中国社会科学院法学研究所,CN11-4560/D
14.,清华法学,清华大学,CN11-5594/D
15.,现代法学,西南政法大学,CN50-1020/D
16.,政法论丛,山东政法学院,CN37-1016/D
17.,政法论坛,中国政法大学,CN11-5608/D
18.,政治与法律,上海社会科学院法学研究所,CN31-1106/D
19.,知识产权,中国知识产权研究会,CN11-2760/N
20.,中国法学,中国法学会,CN11-1030/D
21.,中外法学,北京大学,CN11-2447/D
序号,期刊名称,主办(管)单位,CN号
1.,妇女研究论丛,全国妇联妇女研究所、中国妇女研究会,CN11-2876/C
2.,青年研究,中国社会科学院社会学研究所,CN11-3280/C
3.,人口学刊,吉林大学,CN22-1017/C
4.,人口研究,中国人民大学,CN11-1489/C
5.,人口与发展,北京大学,CN11-5646/F
6.,人口与经济,首都经济贸易大学,CN11-1115/F
7.,社会,上海大学,CN31-1123/C
8.,社会学研究,中国社会科学院社会学研究所,CN11-1100/C
9.,中国青年研究,中国青少年研究中心、中国青少年研究会,CN11-2579/D
10.,中国人口科学,中国社会科学院人口与劳动经济研究所,CN11-1043/C
序号,期刊名称,主办(管)单位,CN号
1,北方民族大学学报,北方民族大学,CN64-1065/G4
2,广西民族大学学报(哲学社会科学版),广西民族大学,CN45-1349/C
3,广西民族研究,广西壮族自治区民族问题研究中心,CN45-1041/C
4,贵州民族研究,贵州省民族研究所,CN52-1001/C
5,民俗研究,山东大学,CN37-1178/K
6,民族教育研究,中央民族大学,CN11-2688/G4
7,民族研究,中国社会科学院民族学与人类学研究所,CN11-1217/C
8,青海民族研究,青海民族大学民族学与社会学学院等,CN63-1016/C
9,世界民族,中国社会科学院民族学与人类学研究所,CN11-3673/C
10,西北民族研究,西北民族大学,CN62-1035/D
11,西南民族大学学报(人文社科版),西南民族大学,CN51-1671/C
12,中国藏学,中国藏学研究中心,CN11-1725/C
13,中南民族大学学报(人文社会科学版),中南民族大学,CN42-1074/C
14,中央民族大学学报(哲学社会科学版),中央民族大学,CN11-3530/C
序号,期刊名称,主办(管)单位,CN号
1,编辑学报,中国科学技术期刊编辑学会,CN11-2493/G3
2,编辑之友,山西出版传媒集团有限责任公司,CN14-1066/G2
3,出版发行研究,中国新闻出版研究院,CN11-1537/G2
4,出版科学,湖北省编辑学会、武汉大学,CN42-1618/G2
5,当代传播,新疆日报社、新疆新闻工作者协会,CN65-1201/G2
6,国际新闻界,中国人民大学,CN11-1523/G2
7,科技与出版,清华大学出版社有限公司,CN11-3209/G3
8,现代出版,中国大学出版社协会等,CN11-5979/G2
9,现代传播(中国传媒大学学报),中国传媒大学,CN11-5363/G2
10,新闻大学,复旦大学,CN31-1157/G2
11,新闻记者,文汇新民联合报业集团等,CN31-1171/G2
12,新闻与传播研究,中国社会科学院新闻与传播研究所,CN11-3320/G2
13,中国编辑,中国编辑学会、高等教育出版社,CN11-4795/G2
14,中国出版,新闻出版报社,CN11-2807/G2
15,中国科技期刊研究,中国科学院自然科学期刊编辑研究会等,CN11-2684/G3
序号,期刊名称,主办(管)单位,CN号
1.,大学图书馆学报,教育部高等学校图书情报工作指导委员会,CN11-2952/G2
2.,档案学通讯,中国人民大学,CN11-1450/G2
3.,档案学研究,中国档案学会,CN11-1226/G2
4.,国家图书馆学刊,中国国家图书馆,CN11-4099/G2
5.,情报科学,中国科技情报学会、吉林大学,CN22-1264/G2
6.,情报理论与实践,中国国防科学技术信息学会,CN11-1762/G3
7.,情报学报,中国科学技术情报学会、中国科学技术信息研究所,CN11-2257/G3
8.,情报杂志,陕西省科学技术信息研究所,CN61-1167/G3
9.,情报资料工作,中国人民大学,CN11-1448/G3
10.,图书馆,湖南图书馆,CN43-1031/G2
11.,图书馆工作与研究,天津图书馆、天津市图书馆协会等,CN12-1020/G2
12.,图书馆建设,黑龙江省图书馆学会、黑龙江省图书馆,CN23-1331/G2
13.,图书馆论坛,广东省中山图书馆,CN44-1306/G2
14.,图书馆学研究,吉林省图书馆,CN22-1052/G2
15.,图书馆杂志,上海市图书馆学会、上海图书馆,CN31-1108/G2
16.,图书情报工作,中国科学院文献情报中心(中国科学院图书馆),CN11-1541/G2
17.,图书情报知识,武汉大学信息管理学院,CN42-1085/G2
18.,图书与情报,甘肃省图书馆,CN62-1026/G2
19.,现代图书情报技术,中国科学院文献情报中心,CN11-2856/G2
20.,中国图书馆学报,中国图书馆学会、国家图书馆,CN11-2746/G2
序号,期刊名称,主办(管)单位,CN号
1.,北京大学教育评论,北京大学,CN11-4848/G4
2.,比较教育研究,北京师范大学,CN11-2878/G4
3.,大学教育科学,湖南大学等,CN43-1398/G4
4.,电化教育研究,西北师范大学等,CN62-1022/G4
5.,复旦教育论坛,复旦大学,CN31-1891/G4
6.,高等工程教育研究,华中科技大学等,CN42-1026/G4
7.,高等教育研究,华中科技大学等,CN42-1024/G4
8.,高教探索,广东省高等教育学会,CN44-1109/G4
9.,国家教育行政学院学报,国家教育行政学院,CN11-5047/D
10.,湖南师范大学教育科学学报,湖南师范大学,CN43-1381/G4
11.,华东师范大学学报(教育科学版),华东师范大学,CN31-1007/G4
12.,江苏高教,江苏教育报刊总社,CN32-1048/G4
13.,教师教育研究,教育部高校师资培训交流北京中心等,CN11-5147/G4
14.,教育发展研究,上海市教育科学研究院等,CN31-1772/G4
15.,教育科学,辽宁师范大学,CN21-1066/G4
16.,教育学报,北京师范大学,CN11-5306/G4
17.,教育研究,中央教育科学研究所,CN11-1281/G4
18.,教育研究与实验,华中师范大学,CN42-1041/G4
19.,教育与经济,华中师范大学、中国教育经济学研究会,CN42-1268/G4
20.,开放教育研究,上海远程教育集团、上海电视大学,CN31-1724/G4
21.,课程.教材.教法,人民教育出版社课程教材研究所,CN11-1278/G4
22.,清华大学教育研究,清华大学,CN11-1610/G4
23.,全球教育展望,华东师范大学,CN31-1842/G4
24.,外国教育研究,东北师范大学,CN22-1022/G4
25.,现代大学教育,湖南省高等教育学会等,CN43-1358/G4
26.,现代教育技术,清华大学,CN11-4525/N
27.,现代远程教育研究,四川广播电视大学,CN51-1580/G4
28.,现代远距离教育,黑龙江广播电视大学等,CN23-1066/G4
29.,学前教育研究,中国学前教育研究会、长沙师范学校,CN43-1038/G4
30.,学位与研究生教育,国务院学位委员会,CN11-1736/G4
31.,远程教育杂志,浙江广播电视大学,CN33-1304/G4
32.,中国电化教育,中央电化教育馆,CN11-3792/G4
33.,中国高等教育,中国教育报刊社,CN11-1200/G4
34.,中国高教研究,中国高等教育学会,CN11-2962/G4
35.,中国教育学刊,中国教育学会,CN11-2606/G4
36.,中国特殊教育,中央教育科学研究所,CN11-3826/G4
序号,期刊名称,主办(管)单位,CN号
1,北京体育大学学报,北京体育大学,CN11-3785/G8
2,上海体育学院学报,上海体育学院,CN31-1005/G8
3,沈阳体育学院学报,沈阳体育学院,CN21-1081/G
4,体育科学,中国体育科学学会,CN11-1295/G8
5,体育学刊,华南理工大学、华南师范大学,CN44-1404/G8
6,体育与科学,江苏省体育科学研究所,CN32-1208/G8
7,天津体育学院学报,天津体育学院,CN12-1140/G8
8,武汉体育学院学报,武汉体育学院,CN42-1105/G8
9,西安体育学院学报,西安体育学院,CN61-1198/G8
10,中国体育科技,国家体育总局体育科学研究所,CN11-2284/G8
序号,期刊名称,主办(管)单位,CN号
1,数理统计与管理,中国现场统计研究会,CN11-2242/O1
2,统计研究,中国统计学会、国家统计局统计科学研究所,CN11-1302/C
3,统计与决策,湖北省统计局统计科学研究所,CN42-1009/C
4,统计与信息论坛,西安财经学院、中国统计教育学会高教分会,CN61-1421/C
序号,期刊名称,主办(管)单位,CN号
